[
  { "operationType": "pesticide", "factorType": "rainfall", "unit": "mm/day", "variable": "dailyRainfall", "greenRange": { "min": 0, "max": 0 }, "yellowRange": { "min": 0.1, "max": 2 }, "redCondition": "dailyRainfall > 2", "meaning": "怕雨冲：药液刚附着即被冲走", "rescheduleCopy": "窗口内有雨，建议推迟打药" },
  { "operationType": "pesticide", "factorType": "windSpeed", "unit": "m/s", "variable": "windSpeed", "greenRange": { "min": 0, "max": 3 }, "yellowRange": { "min": 3.1, "max": 5 }, "redCondition": "windSpeed > 5", "meaning": "怕风飘：药雾飘移药害邻近作物", "rescheduleCopy": "风力偏大，建议择无风时段打药" },
  { "operationType": "pesticide", "factorType": "temperature", "unit": "℃", "variable": "temperature", "greenRange": { "min": 15, "max": 30 }, "yellowRange": { "min": 10, "max": 34 }, "redCondition": "temperature > 35 || temperature < 8", "meaning": "怕高温药害、低温药效差", "rescheduleCopy": "气温不适，建议改至适宜温度时段" },
  { "operationType": "pesticide", "factorType": "humidity", "unit": "%", "variable": "humidity", "greenRange": { "min": 50, "max": 85 }, "yellowRange": { "min": 30, "max": 90 }, "redCondition": "humidity > 92", "meaning": "高湿易致药害与病害", "rescheduleCopy": "湿度偏高，建议推迟打药" },
  { "operationType": "pesticide", "factorType": "soilMoisture", "unit": "%", "variable": "soilMoisture", "greenRange": { "min": 50, "max": 80 }, "yellowRange": { "min": 30, "max": 90 }, "redCondition": "soilMoisture < 25 || soilMoisture > 95", "meaning": "墒情过干或过湿影响药效吸收", "rescheduleCopy": "墒情不适宜，建议改期打药" },
  { "operationType": "pesticide", "factorType": "light", "unit": "h/day", "variable": "light", "greenRange": { "min": 2, "max": 10 }, "yellowRange": { "min": 1, "max": 12 }, "redCondition": "light < 0.5", "meaning": "光照过弱露水重，药效差", "rescheduleCopy": "光照不足，建议改至晴好时段打药" },

  { "operationType": "fertilizer", "factorType": "rainfall", "unit": "mm/3d", "variable": "dailyRainfall", "greenRange": { "min": 0, "max": 0 }, "yellowRange": { "min": 0.1, "max": 5 }, "redCondition": "cumulativeRainfall3d > 10", "meaning": "怕暴雨把肥冲走", "rescheduleCopy": "未来 3 天有雨，建议推迟施肥" },
  { "operationType": "fertilizer", "factorType": "temperature", "unit": "℃", "variable": "temperature", "greenRange": { "min": 12, "max": 30 }, "yellowRange": { "min": 8, "max": 34 }, "redCondition": "temperature < 8 || temperature > 35", "meaning": "怕低温吸收差", "rescheduleCopy": "气温偏低，建议升温后施肥" },
  { "operationType": "fertilizer", "factorType": "windSpeed", "unit": "m/s", "variable": "windSpeed", "greenRange": { "min": 0, "max": 5 }, "yellowRange": { "min": 5.1, "max": 7 }, "redCondition": "windSpeed > 7", "meaning": "大风不利于均匀施用", "rescheduleCopy": "风力偏大，建议缓施" },
  { "operationType": "fertilizer", "factorType": "humidity", "unit": "%", "variable": "humidity", "greenRange": { "min": 40, "max": 85 }, "yellowRange": { "min": 30, "max": 90 }, "redCondition": "humidity > 95", "meaning": "极端高湿影响肥效", "rescheduleCopy": "湿度偏高，建议推迟施肥" },
  { "operationType": "fertilizer", "factorType": "soilMoisture", "unit": "%", "variable": "soilMoisture", "greenRange": { "min": 55, "max": 80 }, "yellowRange": { "min": 40, "max": 90 }, "redCondition": "soilMoisture < 30", "meaning": "墒情不足，肥效难释放", "rescheduleCopy": "墒情偏低，建议灌溉后施肥" },
  { "operationType": "fertilizer", "factorType": "light", "unit": "h/day", "variable": "light", "greenRange": { "min": 2, "max": 12 }, "yellowRange": { "min": 1, "max": 14 }, "redCondition": "light < 0.5", "meaning": "光照过弱不利养分吸收", "rescheduleCopy": "光照不足，建议改期施肥" },

  { "operationType": "irrigation", "factorType": "rainfall", "unit": "mm/day", "variable": "dailyRainfall", "greenRange": { "min": 0, "max": 0 }, "yellowRange": { "min": 0, "max": 0 }, "redCondition": "dailyRainfall > 0", "meaning": "怕白做：降雨即暂缓灌溉", "rescheduleCopy": "已有降雨，建议暂缓灌溉" },
  { "operationType": "irrigation", "factorType": "temperature", "unit": "℃", "variable": "temperature", "greenRange": { "min": 5, "max": 35 }, "yellowRange": { "min": 0, "max": 38 }, "redCondition": "temperature < 0", "meaning": "低温灌溉易伤根", "rescheduleCopy": "气温过低，建议暂缓灌溉" },
  { "operationType": "irrigation", "factorType": "windSpeed", "unit": "m/s", "variable": "windSpeed", "greenRange": { "min": 0, "max": 6 }, "yellowRange": { "min": 6.1, "max": 8 }, "redCondition": "windSpeed > 8", "meaning": "大风蒸发快、水量不均", "rescheduleCopy": "风力偏大，建议暂缓灌溉" },
  { "operationType": "irrigation", "factorType": "humidity", "unit": "%", "variable": "humidity", "greenRange": { "min": 30, "max": 90 }, "yellowRange": { "min": 20, "max": 95 }, "redCondition": "humidity > 98", "meaning": "极端高湿无需灌溉", "rescheduleCopy": "湿度极高，建议暂缓灌溉" },
  { "operationType": "irrigation", "factorType": "soilMoisture", "unit": "%", "variable": "soilMoisture", "greenRange": { "min": 35, "max": 60 }, "yellowRange": { "min": 60, "max": 75 }, "redCondition": "soilMoisture > 80", "meaning": "墒情偏高，无需灌溉", "rescheduleCopy": "土壤已偏湿，建议暂缓灌溉" },
  { "operationType": "irrigation", "factorType": "light", "unit": "h/day", "variable": "light", "greenRange": { "min": 2, "max": 14 }, "yellowRange": { "min": 1, "max": 16 }, "redCondition": "light < 0.5", "meaning": "光照过弱，蒸发量小", "rescheduleCopy": "光照不足，建议暂缓灌溉" },

  { "operationType": "harvest", "factorType": "rainfall", "unit": "mm/day", "variable": "dailyRainfall", "greenRange": { "min": 0, "max": 0 }, "yellowRange": { "min": 0.1, "max": 5 }, "redCondition": "dailyRainfall > 0", "meaning": "怕烂场：遇雨提前抢收", "rescheduleCopy": "有雨风险，建议提前抢收" },
  { "operationType": "harvest", "factorType": "temperature", "unit": "℃", "variable": "temperature", "greenRange": { "min": -5, "max": 35 }, "yellowRange": { "min": -10, "max": 38 }, "redCondition": "temperature < -10", "meaning": "严寒影响采收品质", "rescheduleCopy": "气温过低，建议择时采收" },
  { "operationType": "harvest", "factorType": "windSpeed", "unit": "m/s", "variable": "windSpeed", "greenRange": { "min": 0, "max": 8 }, "yellowRange": { "min": 8.1, "max": 10 }, "redCondition": "windSpeed > 10", "meaning": "大风影响采收与运输", "rescheduleCopy": "风力偏大，建议择时采收" },
  { "operationType": "harvest", "factorType": "humidity", "unit": "%", "variable": "humidity", "greenRange": { "min": 30, "max": 90 }, "yellowRange": { "min": 20, "max": 95 }, "redCondition": "humidity > 95", "meaning": "高湿易致霉烂", "rescheduleCopy": "湿度偏高，建议尽快抢收" },
  { "operationType": "harvest", "factorType": "soilMoisture", "unit": "%", "variable": "soilMoisture", "greenRange": { "min": 40, "max": 70 }, "yellowRange": { "min": 30, "max": 80 }, "redCondition": "soilMoisture > 85", "meaning": "墒情过高，易致霉烂", "rescheduleCopy": "土壤过湿，建议择时采收" },
  { "operationType": "harvest", "factorType": "light", "unit": "h/day", "variable": "light", "greenRange": { "min": 2, "max": 12 }, "yellowRange": { "min": 1, "max": 14 }, "redCondition": "light < 0.5", "meaning": "光照过弱不利晾晒", "rescheduleCopy": "光照不足，建议择时采收" },

  { "operationType": "pesticide", "factorType": "airQuality", "unit": "AQI", "variable": "airQuality", "greenRange": { "min": 0, "max": 100 }, "yellowRange": { "min": 101, "max": 150 }, "redCondition": "airQuality > 150", "meaning": "空气污染重时作物受胁迫，药效差", "rescheduleCopy": "空气质量较差，建议择优时段打药", "source": "中国环境监测总站空气质量标准" },
  { "operationType": "pesticide", "factorType": "uvIndex", "unit": "指数", "variable": "uvIndex", "greenRange": { "min": 0, "max": 5 }, "yellowRange": { "min": 6, "max": 7 }, "redCondition": "uvIndex > 7", "meaning": "强紫外线加速药液光解，药效降低", "rescheduleCopy": "紫外线偏强，建议择早晚时段打药", "source": "中国气象局紫外线指数预报标准" },
  { "operationType": "pesticide", "factorType": "evapotranspiration", "unit": "mm/day", "variable": "evapotranspiration", "greenRange": { "min": 0, "max": 4 }, "yellowRange": { "min": 4.1, "max": 6 }, "redCondition": "evapotranspiration > 6", "meaning": "蒸散量大时药液蒸发快，附着差", "rescheduleCopy": "蒸散量偏大，建议择低蒸散时段打药", "source": "FAO56蒸散量计算标准" },
  { "operationType": "pesticide", "factorType": "soilTemperature", "unit": "℃", "variable": "soilTemperature", "greenRange": { "min": 15, "max": 25 }, "yellowRange": { "min": 10, "max": 30 }, "redCondition": "soilTemperature < 5 || soilTemperature > 35", "meaning": "土温过低或过高影响药效吸收", "rescheduleCopy": "土温不适，建议改期打药", "source": "全国农业技术推广服务中心土壤温度指导" },
  { "operationType": "pesticide", "factorType": "soilEC", "unit": "dS/m", "variable": "soilEC", "greenRange": { "min": 0, "max": 2 }, "yellowRange": { "min": 2.1, "max": 4 }, "redCondition": "soilEC > 4", "meaning": "土壤盐分高时作物受胁迫，药效差", "rescheduleCopy": "土壤盐分偏高，建议改期打药", "source": "中国农业大学土壤电导率评价标准" },

  { "operationType": "fertilizer", "factorType": "airQuality", "unit": "AQI", "variable": "airQuality", "greenRange": { "min": 0, "max": 100 }, "yellowRange": { "min": 101, "max": 200 }, "redCondition": "airQuality > 200", "meaning": "重度污染时作物受胁迫，不宜施肥", "rescheduleCopy": "空气质量差，建议推迟施肥", "source": "中国环境监测总站空气质量标准" },
  { "operationType": "fertilizer", "factorType": "uvIndex", "unit": "指数", "variable": "uvIndex", "greenRange": { "min": 0, "max": 7 }, "yellowRange": { "min": 8, "max": 10 }, "redCondition": "uvIndex > 10", "meaning": "强紫外线下作物受胁迫，肥效差", "rescheduleCopy": "紫外线偏强，建议择弱光时段施肥", "source": "中国气象局紫外线指数预报标准" },
  { "operationType": "fertilizer", "factorType": "evapotranspiration", "unit": "mm/day", "variable": "evapotranspiration", "greenRange": { "min": 0, "max": 5 }, "yellowRange": { "min": 5.1, "max": 7 }, "redCondition": "evapotranspiration > 7", "meaning": "蒸散量大时肥分易挥发损失", "rescheduleCopy": "蒸散量偏大，建议择低蒸散时段施肥", "source": "FAO56蒸散量计算标准" },
  { "operationType": "fertilizer", "factorType": "soilTemperature", "unit": "℃", "variable": "soilTemperature", "greenRange": { "min": 15, "max": 25 }, "yellowRange": { "min": 10, "max": 30 }, "redCondition": "soilTemperature < 5 || soilTemperature > 35", "meaning": "土温过低吸收差，过高易伤根", "rescheduleCopy": "土温不适，建议改期施肥", "source": "全国农业技术推广服务中心土壤温度指导" },
  { "operationType": "fertilizer", "factorType": "soilEC", "unit": "dS/m", "variable": "soilEC", "greenRange": { "min": 0, "max": 2 }, "yellowRange": { "min": 2.1, "max": 3 }, "redCondition": "soilEC > 3", "meaning": "土壤盐分高时施肥加重盐害", "rescheduleCopy": "土壤盐分偏高，建议缓施或先洗盐", "source": "中国农业大学土壤电导率评价标准" },